{
  "$schema": "./_schema.json",
  "id": "wet",
  "display_name_key": "STATUS_WET_NAME",
  "description_key": "STATUS_WET_DESC",
  "icon_path": "",

  "effect_type": "debuff",
  "stack_type": "time",
  "max_stacks": 10,
  "initial_stacks": 1,

  "applicable_to": ["guest"],

  "stat_modifiers": [],

  "granted_skills": [
    { "skill_id": "wet_block_entry" }
  ],

  "on_apply_effects": [],

  "on_turn_end_effects": [
    {
      "type": "remove_stacks",
      "amount": 1
    }
  ],

  "on_remove_effects": [],

  "visual": {
    "particle_effect": "",
    "tint_color": "#4169E1"
  },

  "tags": ["debuff"]
}
